{
    "schema_version": "1.0.0",
    "job_id": "job_001",
    "created_at": "2026-05-06T10:00:00Z",
    "created_by": "orchestrator",
    "input": {
        "source_video": {
            "object_key": "jobs/job_001/input/source.mp4",
            "original_filename": "episode_001_source.mp4",
            "uploaded_at": "2026-05-06T09:59:55Z",
            "content_type": "video/mp4",
            "checksum_sha256": "0123456789abcdef0123456789abcdef0123456789abcdef0123456789abcdef"
        }
    },
    "target_output": {
        "aspect_ratio": "9:16",
        "resolution": {
            "width": 1080,
            "height": 1920
        },
        "format": "mp4",
        "object_key": "jobs/job_001/outputs/final_9x16.mp4"
    },
    "pipeline": {
        "pipeline_id": "phase1_smooth_reframe_16x9_to_9x16",
        "steps": [
            "validation",
            "media_metadata",
            "proxy_frame_sampling",
            "body_detection",
            "track_interpolation",
            "reframe_planning",
            "easing_smoothing",
            "render_plan_compiler",
            "ffmpeg_renderer"
        ]
    },
    "service_config": {
        "proxy_frame_sampling": {
            "sample_every_n_source_frames": 1,
            "proxy_height": 540
        },
        "body_detection": {
            "subject_selection_strategy": "nearest_previous_crop_center",
            "min_confidence": 0.9,
            "model_path": "yolov8m.pt",
            "device_preference": "gpu_first",
            "image_size": 640,
            "person_class_id": 0
        },
        "track_interpolation": {
            "max_gap_fill_seconds": 1.0,
            "max_center_jump_per_second": 600,
            "missing_strategy": "hold_then_center"
        },
        "reframe_planning": {
            "framing_mode": "center_subject",
            "clamp_to_source": true
        },
        "easing_smoothing": {
            "smoothing_method": "exponential",
            "smoothing_strength": 0.82,
            "max_velocity_px_per_second": 700,
            "max_acceleration_px_per_second2": 1600,
            "easing": "easeInOutCubic",
            "dead_zone_px": 80
        },
        "render_plan_compiler": {
            "crop_representation": "keyframe_list",
            "audio_policy": "copy_if_possible_else_aac",
            "compiler_render_mode": "smooth_crop"
        },
        "ffmpeg_renderer": {
            "video_codec": "libx264",
            "audio_codec": "aac"
        }
    }
}